[{"schema_version": "1.0", "snapshot_id": "lumos-20261009T182337Z-9e1ef412", "aoi_id": "BGD", "period_start_utc": "2013-01-01T00:00:00Z", "period_end_utc_exclusive": "2013-02-01T00:00:00Z", "source_platform": "Aqua", "reference_platform": "S-NPP", "source_product": "MODIS C6.1 (FIRMS country CSV)", "reference_product": "VIIRS 375m S-NPP (FIRMS country CSV)", "raw_modis_detections": 17, "raw_modis_terra_detections": 17, "raw_viirs_reference_detections": 65, "static_source_detections_modis": 32, "static_source_detections_viirs": 83, "estimated_viirs_reference_detections": 58.46, "estimate_interval_low": 44.04, "estimate_interval_high": 177.37, "interval_nominal_level": 0.8, "interval_empirical_holdout_coverage": 0.8, "extract_status": "complete", "coverage_status": "unknown", "coverage_fraction": null, "value_status": "demo", "split": "train", "anomaly": {"baseline_years": 22, "rank": 15, "zscore_log": -0.452, "flag": "normal"}, "model_id": "B0_month_ratio", "provenance_ids": ["modis_2013_Bangladesh", "viirs-snpp_2013_Bangladesh"], "reason": "SYNTHETIC FIXTURE \u2014 NOT REAL DATA. Observed S-NPP VIIRS reference; estimate from Aqua shown for comparison. Anomaly is retrospective vs same-month 5+ baseline years (complete months only)."}, {"schema_version": "1.0", "snapshot_id": "lumos-20261009T182337Z-9e1ef412", "aoi_id": "BGD", "period_start_utc": "2013-02-01T00:00:00Z", "period_end_utc_exclusive": "2013-03-01T00:00:00Z", "source_platform": "Aqua", "reference_platform": "S-NPP", "source_product": "MODIS C6.1 (FIRMS country CSV)", "reference_product": "VIIRS 375m S-NPP (FIRMS country CSV)", "raw_modis_detections": 73, "raw_modis_terra_detections": 60, "raw_viirs_reference_detections": 222, "static_source_detections_modis": 28, "static_source_detections_viirs": 71, "estimated_viirs_reference_detections": 265.84, "estimate_interval_low": 201.14, "estimate_interval_high": 799.52, "interval_nominal_level": 0.8, "interval_empirical_holdout_coverage": 0.8, "extract_status": "complete", "coverage_status": "unknown", "coverage_fraction": null, "value_status": "demo", "split": "train", "anomaly": {"baseline_years": 22, "rank": 10, "zscore_log": -0.106, "flag": "normal"}, "model_id": "B0_month_ratio", "provenance_ids": ["modis_2013_Bangladesh", "viirs-snpp_2013_Bangladesh"], "reason": "SYNTHETIC FIXTURE \u2014 NOT REAL DATA. Observed S-NPP VIIRS reference; estimate from Aqua shown for comparison. Anomaly is retrospective vs same-month 5+ baseline years (complete months only)."}, {"schema_version": "1.0", "snapshot_id": "lumos-20261009T182337Z-9e1ef412", "aoi_id": "BGD", "period_start_utc": "2013-03-01T00:00:00Z", "period_end_utc_exclusive": "2013-04-01T00:00:00Z", "source_platform": "Aqua", "reference_platform": "S-NPP", "source_product": "MODIS C6.1 (FIRMS country CSV)", "reference_product": "VIIRS 375m S-NPP (FIRMS country CSV)", "raw_modis_detections": 133, "raw_modis_terra_detections": 115, "raw_viirs_reference_detections": 490, "static_source_detections_modis": 25, "static_source_detections_viirs": 82, "estimated_viirs_reference_detections": 468.65, "estimate_interval_low": 354.78, "estimate_interval_high": 1407.96, "interval_nominal_level": 0.8, "interval_empirical_holdout_coverage": 0.8, "extract_status": "complete", "coverage_status": "unknown", "coverage_fraction": null, "value_status": "demo", "split": "train", "anomaly": {"baseline_years": 22, "rank": 9, "zscore_log": 0.355, "flag": "normal"}, "model_id": "B0_month_ratio", "provenance_ids": ["modis_2013_Bangladesh", "viirs-snpp_2013_Bangladesh"], "reason": "SYNTHETIC FIXTURE \u2014 NOT REAL DATA. Observed S-NPP VIIRS reference; estimate from Aqua shown for comparison. Anomaly is retrospective vs same-month 5+ baseline years (complete months only)."}, {"schema_version": "1.0", "snapshot_id": "lumos-20261009T182337Z-9e1ef412", "aoi_id": "BGD", "period_start_utc": "2013-04-01T00:00:00Z", "period_end_utc_exclusive": "2013-05-01T00:00:00Z", "source_platform": "Aqua", "reference_platform": "S-NPP", "source_product": "MODIS C6.1 (FIRMS country CSV)", "reference_product": "VIIRS 375m S-NPP (FIRMS country CSV)", "raw_modis_detections": 122, "raw_modis_terra_detections": 106, "raw_viirs_reference_detections": 434, "static_source_detections_modis": 34, "static_source_detections_viirs": 53, "estimated_viirs_reference_detections": 388.32, "estimate_interval_low": 293.93, "estimate_interval_high": 1166.97, "interval_nominal_level": 0.8, "interval_empirical_holdout_coverage": 0.8, "extract_status": "complete", "coverage_status": "unknown", "coverage_fraction": null, "value_status": "demo", "split": "train", "anomaly": {"baseline_years": 22, "rank": 1, "zscore_log": 1.364, "flag": "high"}, "model_id": "B0_month_ratio", "provenance_ids": ["modis_2013_Bangladesh", "viirs-snpp_2013_Bangladesh"], "reason": "SYNTHETIC FIXTURE \u2014 NOT REAL DATA. Observed S-NPP VIIRS reference; estimate from Aqua shown for comparison. Anomaly is retrospective vs same-month 5+ baseline years (complete months only)."}, {"schema_version": "1.0", "snapshot_id": "lumos-20261009T182337Z-9e1ef412", "aoi_id": "BGD", "period_start_utc": "2013-05-01T00:00:00Z", "period_end_utc_exclusive": "2013-06-01T00:00:00Z", "source_platform": "Aqua", "reference_platform": "S-NPP", "source_product": "MODIS C6.1 (FIRMS country CSV)", "reference_product": "VIIRS 375m S-NPP (FIRMS country CSV)", "raw_modis_detections": 31, "raw_modis_terra_detections": 24, "raw_viirs_reference_detections": 105, "static_source_detections_modis": 0, "static_source_detections_viirs": 0, "estimated_viirs_reference_detections": 125.25, "estimate_interval_low": 94.64, "estimate_interval_high": 377.74, "interval_nominal_level": 0.8, "interval_empirical_holdout_coverage": 0.8, "extract_status": "complete", "coverage_status": "unknown", "coverage_fraction": null, "value_status": "demo", "split": "train", "anomaly": {"baseline_years": 22, "rank": 5, "zscore_log": 0.776, "flag": "normal"}, "model_id": "B0_month_ratio", "provenance_ids": ["modis_2013_Bangladesh", "viirs-snpp_2013_Bangladesh"], "reason": "SYNTHETIC FIXTURE \u2014 NOT REAL DATA. Observed S-NPP VIIRS reference; estimate from Aqua shown for comparison. Anomaly is retrospective vs same-month 5+ baseline years (complete months only)."}, {"schema_version": "1.0", "snapshot_id": "lumos-20261009T182337Z-9e1ef412", "aoi_id": "BGD", "period_start_utc": "2013-06-01T00:00:00Z", "period_end_utc_exclusive": "2013-07-01T00:00:00Z", "source_platform": "Aqua", "reference_platform": "S-NPP", "source_product": "MODIS C6.1 (FIRMS country CSV)", "reference_product": "VIIRS 375m S-NPP (FIRMS country CSV)", "raw_modis_detections": 0, "raw_modis_terra_detections": 0, "raw_viirs_reference_detections": 3, "static_source_detections_modis": 0, "static_source_detections_viirs": 0, "estimated_viirs_reference_detections": 0.0, "estimate_interval_low": 0.0, "estimate_interval_high": 2.0, "interval_nominal_level": 0.8, "interval_empirical_holdout_coverage": 0.8, "extract_status": "complete", "coverage_status": "unknown", "coverage_fraction": null, "value_status": "demo", "split": "train", "anomaly": {"baseline_years": 22, "rank": 15, "zscore_log": -0.04, "flag": "normal"}, "model_id": "B0_month_ratio", "provenance_ids": ["modis_2013_Bangladesh", "viirs-snpp_2013_Bangladesh"], "reason": "SYNTHETIC FIXTURE \u2014 NOT REAL DATA. Observed S-NPP VIIRS reference; estimate from Aqua shown for comparison. Anomaly is retrospective vs same-month 5+ baseline years (complete months only)."}, {"schema_version": "1.0", "snapshot_id": "lumos-20261009T182337Z-9e1ef412", "aoi_id": "BGD", "period_start_utc": "2013-07-01T00:00:00Z", "period_end_utc_exclusive": "2013-08-01T00:00:00Z", "source_platform": "Aqua", "reference_platform": "S-NPP", "source_product": "MODIS C6.1 (FIRMS country CSV)", "reference_product": "VIIRS 375m S-NPP (FIRMS country CSV)", "raw_modis_detections": 2, "raw_modis_terra_detections": 2, "raw_viirs_reference_detections": 13, "static_source_detections_modis": 0, "static_source_detections_viirs": 0, "estimated_viirs_reference_detections": 5.12, "estimate_interval_low": 3.64, "estimate_interval_high": 17.38, "interval_nominal_level": 0.8, "interval_empirical_holdout_coverage": 0.8, "extract_status": "complete", "coverage_status": "unknown", "coverage_fraction": null, "value_status": "demo", "split": "train", "anomaly": {"baseline_years": 22, "rank": 4, "zscore_log": 1.038, "flag": "high"}, "model_id": "B0_month_ratio", "provenance_ids": ["modis_2013_Bangladesh", "viirs-snpp_2013_Bangladesh"], "reason": "SYNTHETIC FIXTURE \u2014 NOT REAL DATA. Observed S-NPP VIIRS reference; estimate from Aqua shown for comparison. Anomaly is retrospective vs same-month 5+ baseline years (complete months only)."}, {"schema_version": "1.0", "snapshot_id": "lumos-20261009T182337Z-9e1ef412", "aoi_id": "BGD", "period_start_utc": "2013-08-01T00:00:00Z", "period_end_utc_exclusive": "2013-09-01T00:00:00Z", "source_platform": "Aqua", "reference_platform": "S-NPP", "source_product": "MODIS C6.1 (FIRMS country CSV)", "reference_product": "VIIRS 375m S-NPP (FIRMS country CSV)", "raw_modis_detections": 0, "raw_modis_terra_detections": 0, "raw_viirs_reference_detections": 1, "static_source_detections_modis": 0, "static_source_detections_viirs": 0, "estimated_viirs_reference_detections": 0.0, "estimate_interval_low": 0.0, "estimate_interval_high": 2.0, "interval_nominal_level": 0.8, "interval_empirical_holdout_coverage": 0.8, "extract_status": "complete", "coverage_status": "unknown", "coverage_fraction": null, "value_status": "demo", "split": "train", "anomaly": {"baseline_years": 22, "rank": 17, "zscore_log": -0.796, "flag": "normal"}, "model_id": "B0_month_ratio", "provenance_ids": ["modis_2013_Bangladesh", "viirs-snpp_2013_Bangladesh"], "reason": "SYNTHETIC FIXTURE \u2014 NOT REAL DATA. Observed S-NPP VIIRS reference; estimate from Aqua shown for comparison. Anomaly is retrospective vs same-month 5+ baseline years (complete months only)."}, {"sc